"No.","Time","Source","Destination","Protocol","Length","Info"
"1","0.000000000","127.0.0.1","127.0.0.1","TCP","74","60668  >  8080 [SYN] Seq=0 Win=65495 Len=0 MSS=65495 SACK_PERM=1 TSval=2280356040 TSecr=0 WS=128"
"3","0.000014090","127.0.0.1","127.0.0.1","TCP","66","60668  >  8080 [ACK] Seq=1 Ack=1 Win=65536 Len=0 TSval=2280356040 TSecr=2280356040"
"4","0.000040604","127.0.0.1","127.0.0.1","TCP","70","60668  >  8080 [PSH, ACK] Seq=1 Ack=1 Win=65536 Len=4 TSval=2280356040 TSecr=2280356040"
"6","0.000047900","127.0.0.1","127.0.0.1","TCP","68","60668  >  8080 [PSH, ACK] Seq=5 Ack=1 Win=65536 Len=2 TSval=2280356040 TSecr=2280356040 [TCP segment of a reassembled PDU]"
"9","0.002413822","127.0.0.1","127.0.0.1","TCP","66","60668  >  8080 [ACK] Seq=7 Ack=13 Win=65536 Len=0 TSval=2280356043 TSecr=2280356043"
"11","1.006536516","127.0.0.1","127.0.0.1","TCP","66","60668  >  8080 [ACK] Seq=7 Ack=21 Win=65536 Len=0 TSval=2280357047 TSecr=2280357047"
"13","1.006583370","127.0.0.1","127.0.0.1","TCP","66","60668  >  8080 [ACK] Seq=7 Ack=220 Win=65408 Len=0 TSval=2280357047 TSecr=2280357047"
"14","2.012634188","127.0.0.1","127.0.0.1","TCP","70","60668  >  8080 [PSH, ACK] Seq=7 Ack=220 Win=65536 Len=4 TSval=2280358053 TSecr=2280357047 [TCP segment of a reassembled PDU]"
"16","2.012679053","127.0.0.1","127.0.0.1","TCP","83","60668  >  8080 [PSH, ACK] Seq=11 Ack=220 Win=65536 Len=17 TSval=2280358053 TSecr=2280358053"
"18","2.012708872","127.0.0.1","127.0.0.1","TCP","66","60668  >  8080 [FIN, ACK] Seq=28 Ack=220 Win=65536 Len=0 TSval=2280358053 TSecr=2280358053"
"20","2.012776069","127.0.0.1","127.0.0.1","TCP","66","60668  >  8080 [ACK] Seq=29 Ack=221 Win=65536 Len=0 TSval=2280358053 TSecr=2280358053"
"21","2.014131639","127.0.0.1","127.0.0.1","TCP","74","60670  >  8080 [SYN] Seq=0 Win=65495 Len=0 MSS=65495 SACK_PERM=1 TSval=2280358055 TSecr=0 WS=128"
"23","2.014143439","127.0.0.1","127.0.0.1","TCP","66","60670  >  8080 [ACK] Seq=1 Ack=1 Win=65536 Len=0 TSval=2280358055 TSecr=2280358055"
"24","2.014172945","127.0.0.1","127.0.0.1","TCP","70","60670  >  8080 [PSH, ACK] Seq=1 Ack=1 Win=65536 Len=4 TSval=2280358055 TSecr=2280358055"
"26","2.014181047","127.0.0.1","127.0.0.1","TCP","68","60670  >  8080 [PSH, ACK] Seq=5 Ack=1 Win=65536 Len=2 TSval=2280358055 TSecr=2280358055 [TCP segment of a reassembled PDU]"
"29","2.016595726","127.0.0.1","127.0.0.1","TCP","66","60670  >  8080 [ACK] Seq=7 Ack=13 Win=65536 Len=0 TSval=2280358057 TSecr=2280358057"
"31","3.018078304","127.0.0.1","127.0.0.1","TCP","66","60670  >  8080 [ACK] Seq=7 Ack=21 Win=65536 Len=0 TSval=2280359058 TSecr=2280359058"
"33","3.018090502","127.0.0.1","127.0.0.1","TCP","66","60670  >  8080 [ACK] Seq=7 Ack=220 Win=65408 Len=0 TSval=2280359058 TSecr=2280359058"
"34","4.026177036","127.0.0.1","127.0.0.1","TCP","70","60670  >  8080 [PSH, ACK] Seq=7 Ack=220 Win=65536 Len=4 TSval=2280360067 TSecr=2280359058 [TCP segment of a reassembled PDU]"
"36","4.026211327","127.0.0.1","127.0.0.1","TCP","83","60670  >  8080 [PSH, ACK] Seq=11 Ack=220 Win=65536 Len=17 TSval=2280360067 TSecr=2280360067"
"38","4.026244382","127.0.0.1","127.0.0.1","TCP","66","60670  >  8080 [FIN, ACK] Seq=28 Ack=220 Win=65536 Len=0 TSval=2280360067 TSecr=2280360067"
"40","4.026287221","127.0.0.1","127.0.0.1","TCP","66","60670  >  8080 [ACK] Seq=29 Ack=221 Win=65536 Len=0 TSval=2280360067 TSecr=2280360067"
"41","4.027853802","127.0.0.1","127.0.0.1","TCP","74","60672  >  8080 [SYN] Seq=0 Win=65495 Len=0 MSS=65495 SACK_PERM=1 TSval=2280360068 TSecr=0 WS=128"
"43","4.027866000","127.0.0.1","127.0.0.1","TCP","66","60672  >  8080 [ACK] Seq=1 Ack=1 Win=65536 Len=0 TSval=2280360068 TSecr=2280360068"
"44","4.027897925","127.0.0.1","127.0.0.1","TCP","70","60672  >  8080 [PSH, ACK] Seq=1 Ack=1 Win=65536 Len=4 TSval=2280360068 TSecr=2280360068"
"46","4.027907049","127.0.0.1","127.0.0.1","TCP","68","60672  >  8080 [PSH, ACK] Seq=5 Ack=1 Win=65536 Len=2 TSval=2280360068 TSecr=2280360068 [TCP segment of a reassembled PDU]"
"49","4.030569206","127.0.0.1","127.0.0.1","TCP","66","60672  >  8080 [ACK] Seq=7 Ack=13 Win=65536 Len=0 TSval=2280360071 TSecr=2280360071"
"51","5.032567297","127.0.0.1","127.0.0.1","TCP","66","60672  >  8080 [ACK] Seq=7 Ack=21 Win=65536 Len=0 TSval=2280361073 TSecr=2280361073"
"53","5.032627378","127.0.0.1","127.0.0.1","TCP","66","60672  >  8080 [ACK] Seq=7 Ack=220 Win=65408 Len=0 TSval=2280361073 TSecr=2280361073"
"54","6.043190544","127.0.0.1","127.0.0.1","TCP","70","60672  >  8080 [PSH, ACK] Seq=7 Ack=220 Win=65536 Len=4 TSval=2280362084 TSecr=2280361073 [TCP segment of a reassembled PDU]"
"56","6.043313156","127.0.0.1","127.0.0.1","TCP","83","60672  >  8080 [PSH, ACK] Seq=11 Ack=220 Win=65536 Len=17 TSval=2280362084 TSecr=2280362084"
"58","6.043431557","127.0.0.1","127.0.0.1","TCP","66","60672  >  8080 [FIN, ACK] Seq=28 Ack=220 Win=65536 Len=0 TSval=2280362084 TSecr=2280362084"
"60","6.043546103","127.0.0.1","127.0.0.1","TCP","66","60672  >  8080 [ACK] Seq=29 Ack=221 Win=65536 Len=0 TSval=2280362084 TSecr=2280362084"
"61","6.048900943","127.0.0.1","127.0.0.1","TCP","74","60674  >  8080 [SYN] Seq=0 Win=65495 Len=0 MSS=65495 SACK_PERM=1 TSval=2280362089 TSecr=0 WS=128"
"63","6.048944279","127.0.0.1","127.0.0.1","TCP","66","60674  >  8080 [ACK] Seq=1 Ack=1 Win=65536 Len=0 TSval=2280362089 TSecr=2280362089"
"64","6.049205262","127.0.0.1","127.0.0.1","TCP","70","60674  >  8080 [PSH, ACK] Seq=1 Ack=1 Win=65536 Len=4 TSval=2280362090 TSecr=2280362089"
"66","6.049245182","127.0.0.1","127.0.0.1","TCP","68","60674  >  8080 [PSH, ACK] Seq=5 Ack=1 Win=65536 Len=2 TSval=2280362090 TSecr=2280362090 [TCP segment of a reassembled PDU]"
"69","6.059181986","127.0.0.1","127.0.0.1","TCP","66","60674  >  8080 [ACK] Seq=7 Ack=13 Win=65536 Len=0 TSval=2280362100 TSecr=2280362100"
"71","7.059882643","127.0.0.1","127.0.0.1","TCP","66","60674  >  8080 [ACK] Seq=7 Ack=21 Win=65536 Len=0 TSval=2280363100 TSecr=2280363100"
"73","7.059935089","127.0.0.1","127.0.0.1","TCP","66","60674  >  8080 [ACK] Seq=7 Ack=220 Win=65408 Len=0 TSval=2280363100 TSecr=2280363100"
"74","8.072394459","127.0.0.1","127.0.0.1","TCP","70","60674  >  8080 [PSH, ACK] Seq=7 Ack=220 Win=65536 Len=4 TSval=2280364113 TSecr=2280363100 [TCP segment of a reassembled PDU]"
"76","8.072515815","127.0.0.1","127.0.0.1","TCP","83","60674  >  8080 [PSH, ACK] Seq=11 Ack=220 Win=65536 Len=17 TSval=2280364113 TSecr=2280364113"
"78","8.072579939","127.0.0.1","127.0.0.1","TCP","66","60674  >  8080 [FIN, ACK] Seq=28 Ack=220 Win=65536 Len=0 TSval=2280364113 TSecr=2280364113"
"80","8.072717156","127.0.0.1","127.0.0.1","TCP","66","60674  >  8080 [ACK] Seq=29 Ack=221 Win=65536 Len=0 TSval=2280364113 TSecr=2280364113"
"81","8.077770728","127.0.0.1","127.0.0.1","TCP","74","60676  >  8080 [SYN] Seq=0 Win=65495 Len=0 MSS=65495 SACK_PERM=1 TSval=2280364118 TSecr=0 WS=128"
"83","8.077813790","127.0.0.1","127.0.0.1","TCP","66","60676  >  8080 [ACK] Seq=1 Ack=1 Win=65536 Len=0 TSval=2280364118 TSecr=2280364118"
"84","8.077968346","127.0.0.1","127.0.0.1","TCP","70","60676  >  8080 [PSH, ACK] Seq=1 Ack=1 Win=65536 Len=4 TSval=2280364118 TSecr=2280364118"
"86","8.078006904","127.0.0.1","127.0.0.1","TCP","68","60676  >  8080 [PSH, ACK] Seq=5 Ack=1 Win=65536 Len=2 TSval=2280364118 TSecr=2280364118 [TCP segment of a reassembled PDU]"
"89","8.082279614","127.0.0.1","127.0.0.1","TCP","66","60676  >  8080 [ACK] Seq=7 Ack=13 Win=65536 Len=0 TSval=2280364123 TSecr=2280364123"
"91","9.086345018","127.0.0.1","127.0.0.1","TCP","66","60676  >  8080 [ACK] Seq=7 Ack=21 Win=65536 Len=0 TSval=2280365127 TSecr=2280365127"
"93","9.086381311","127.0.0.1","127.0.0.1","TCP","66","60676  >  8080 [ACK] Seq=7 Ack=220 Win=65408 Len=0 TSval=2280365127 TSecr=2280365127"
"94","10.097038650","127.0.0.1","127.0.0.1","TCP","70","60676  >  8080 [PSH, ACK] Seq=7 Ack=220 Win=65536 Len=4 TSval=2280366137 TSecr=2280365127 [TCP segment of a reassembled PDU]"
"96","10.097087246","127.0.0.1","127.0.0.1","TCP","83","60676  >  8080 [PSH, ACK] Seq=11 Ack=220 Win=65536 Len=17 TSval=2280366137 TSecr=2280366137"
"98","10.097120398","127.0.0.1","127.0.0.1","TCP","66","60676  >  8080 [FIN, ACK] Seq=28 Ack=220 Win=65536 Len=0 TSval=2280366137 TSecr=2280366137"
"100","10.097171430","127.0.0.1","127.0.0.1","TCP","66","60676  >  8080 [ACK] Seq=29 Ack=221 Win=65536 Len=0 TSval=2280366138 TSecr=2280366138"
"101","10.098658308","127.0.0.1","127.0.0.1","TCP","74","60678  >  8080 [SYN] Seq=0 Win=65495 Len=0 MSS=65495 SACK_PERM=1 TSval=2280366139 TSecr=0 WS=128"
"103","10.098670427","127.0.0.1","127.0.0.1","TCP","66","60678  >  8080 [ACK] Seq=1 Ack=1 Win=65536 Len=0 TSval=2280366139 TSecr=2280366139"
"104","10.098702889","127.0.0.1","127.0.0.1","TCP","70","60678  >  8080 [PSH, ACK] Seq=1 Ack=1 Win=65536 Len=4 TSval=2280366139 TSecr=2280366139"
"106","10.098712045","127.0.0.1","127.0.0.1","TCP","68","60678  >  8080 [PSH, ACK] Seq=5 Ack=1 Win=65536 Len=2 TSval=2280366139 TSecr=2280366139 [TCP segment of a reassembled PDU]"
"109","10.101140349","127.0.0.1","127.0.0.1","TCP","66","60678  >  8080 [ACK] Seq=7 Ack=13 Win=65536 Len=0 TSval=2280366142 TSecr=2280366142"
"111","11.103597905","127.0.0.1","127.0.0.1","TCP","66","60678  >  8080 [ACK] Seq=7 Ack=21 Win=65536 Len=0 TSval=2280367144 TSecr=2280367144"
"113","11.103654600","127.0.0.1","127.0.0.1","TCP","66","60678  >  8080 [ACK] Seq=7 Ack=220 Win=65408 Len=0 TSval=2280367144 TSecr=2280367144"
"114","12.111449653","127.0.0.1","127.0.0.1","TCP","70","60678  >  8080 [PSH, ACK] Seq=7 Ack=220 Win=65536 Len=4 TSval=2280368152 TSecr=2280367144 [TCP segment of a reassembled PDU]"
"116","12.111498707","127.0.0.1","127.0.0.1","TCP","83","60678  >  8080 [PSH, ACK] Seq=11 Ack=220 Win=65536 Len=17 TSval=2280368152 TSecr=2280368152"
"119","12.111610314","127.0.0.1","127.0.0.1","TCP","66","60678  >  8080 [FIN, ACK] Seq=28 Ack=221 Win=65536 Len=0 TSval=2280368152 TSecr=2280368152"
"121","12.113329937","127.0.0.1","127.0.0.1","TCP","74","60680  >  8080 [SYN] Seq=0 Win=65495 Len=0 MSS=65495 SACK_PERM=1 TSval=2280368154 TSecr=0 WS=128"
"123","12.113342541","127.0.0.1","127.0.0.1","TCP","66","60680  >  8080 [ACK] Seq=1 Ack=1 Win=65536 Len=0 TSval=2280368154 TSecr=2280368154"
"124","12.113382427","127.0.0.1","127.0.0.1","TCP","70","60680  >  8080 [PSH, ACK] Seq=1 Ack=1 Win=65536 Len=4 TSval=2280368154 TSecr=2280368154"
"126","12.113391588","127.0.0.1","127.0.0.1","TCP","68","60680  >  8080 [PSH, ACK] Seq=5 Ack=1 Win=65536 Len=2 TSval=2280368154 TSecr=2280368154 [TCP segment of a reassembled PDU]"
"129","12.116256360","127.0.0.1","127.0.0.1","TCP","66","60680  >  8080 [ACK] Seq=7 Ack=13 Win=65536 Len=0 TSval=2280368157 TSecr=2280368157"
"131","13.116751487","127.0.0.1","127.0.0.1","TCP","66","60680  >  8080 [ACK] Seq=7 Ack=21 Win=65536 Len=0 TSval=2280369157 TSecr=2280369157"
"133","13.116798763","127.0.0.1","127.0.0.1","TCP","66","60680  >  8080 [ACK] Seq=7 Ack=220 Win=65408 Len=0 TSval=2280369157 TSecr=2280369157"
"134","14.123435970","127.0.0.1","127.0.0.1","TCP","70","60680  >  8080 [PSH, ACK] Seq=7 Ack=220 Win=65536 Len=4 TSval=2280370164 TSecr=2280369157 [TCP segment of a reassembled PDU]"
"136","14.123544915","127.0.0.1","127.0.0.1","TCP","83","60680  >  8080 [PSH, ACK] Seq=11 Ack=220 Win=65536 Len=17 TSval=2280370164 TSecr=2280370164"
"138","14.123585793","127.0.0.1","127.0.0.1","TCP","66","60680  >  8080 [FIN, ACK] Seq=28 Ack=220 Win=65536 Len=0 TSval=2280370164 TSecr=2280370164"
"140","14.123631398","127.0.0.1","127.0.0.1","TCP","66","60680  >  8080 [ACK] Seq=29 Ack=221 Win=65536 Len=0 TSval=2280370164 TSecr=2280370164"
"141","14.126677880","127.0.0.1","127.0.0.1","TCP","74","60682  >  8080 [SYN] Seq=0 Win=65495 Len=0 MSS=65495 SACK_PERM=1 TSval=2280370167 TSecr=0 WS=128"
"143","14.126698500","127.0.0.1","127.0.0.1","TCP","66","60682  >  8080 [ACK] Seq=1 Ack=1 Win=65536 Len=0 TSval=2280370167 TSecr=2280370167"
"144","14.126751483","127.0.0.1","127.0.0.1","TCP","70","60682  >  8080 [PSH, ACK] Seq=1 Ack=1 Win=65536 Len=4 TSval=2280370167 TSecr=2280370167"
"146","14.126766808","127.0.0.1","127.0.0.1","TCP","68","60682  >  8080 [PSH, ACK] Seq=5 Ack=1 Win=65536 Len=2 TSval=2280370167 TSecr=2280370167 [TCP segment of a reassembled PDU]"
"149","14.131207742","127.0.0.1","127.0.0.1","TCP","66","60682  >  8080 [ACK] Seq=7 Ack=13 Win=65536 Len=0 TSval=2280370172 TSecr=2280370172"
"151","15.134174425","127.0.0.1","127.0.0.1","TCP","66","60682  >  8080 [ACK] Seq=7 Ack=21 Win=65536 Len=0 TSval=2280371174 TSecr=2280371174"
"153","15.134237389","127.0.0.1","127.0.0.1","TCP","66","60682  >  8080 [ACK] Seq=7 Ack=220 Win=65408 Len=0 TSval=2280371175 TSecr=2280371175"
"154","16.143759247","127.0.0.1","127.0.0.1","TCP","70","60682  >  8080 [PSH, ACK] Seq=7 Ack=220 Win=65536 Len=4 TSval=2280372184 TSecr=2280371175 [TCP segment of a reassembled PDU]"
"156","16.143793634","127.0.0.1","127.0.0.1","TCP","83","60682  >  8080 [PSH, ACK] Seq=11 Ack=220 Win=65536 Len=17 TSval=2280372184 TSecr=2280372184"
"158","16.143824329","127.0.0.1","127.0.0.1","TCP","66","60682  >  8080 [FIN, ACK] Seq=28 Ack=220 Win=65536 Len=0 TSval=2280372184 TSecr=2280372184"
"160","16.143877932","127.0.0.1","127.0.0.1","TCP","66","60682  >  8080 [ACK] Seq=29 Ack=221 Win=65536 Len=0 TSval=2280372184 TSecr=2280372184"
"161","16.145395363","127.0.0.1","127.0.0.1","TCP","74","60684  >  8080 [SYN] Seq=0 Win=65495 Len=0 MSS=65495 SACK_PERM=1 TSval=2280372186 TSecr=0 WS=128"
"163","16.145407450","127.0.0.1","127.0.0.1","TCP","66","60684  >  8080 [ACK] Seq=1 Ack=1 Win=65536 Len=0 TSval=2280372186 TSecr=2280372186"
"164","16.145437236","127.0.0.1","127.0.0.1","TCP","70","60684  >  8080 [PSH, ACK] Seq=1 Ack=1 Win=65536 Len=4 TSval=2280372186 TSecr=2280372186"
"166","16.145445874","127.0.0.1","127.0.0.1","TCP","68","60684  >  8080 [PSH, ACK] Seq=5 Ack=1 Win=65536 Len=2 TSval=2280372186 TSecr=2280372186 [TCP segment of a reassembled PDU]"
"169","16.147863763","127.0.0.1","127.0.0.1","TCP","66","60684  >  8080 [ACK] Seq=7 Ack=13 Win=65536 Len=0 TSval=2280372188 TSecr=2280372188"
"171","17.150524989","127.0.0.1","127.0.0.1","TCP","66","60684  >  8080 [ACK] Seq=7 Ack=21 Win=65536 Len=0 TSval=2280373191 TSecr=2280373191"
"173","17.150584534","127.0.0.1","127.0.0.1","TCP","66","60684  >  8080 [ACK] Seq=7 Ack=220 Win=65408 Len=0 TSval=2280373191 TSecr=2280373191"
"174","18.158714865","127.0.0.1","127.0.0.1","TCP","70","60684  >  8080 [PSH, ACK] Seq=7 Ack=220 Win=65536 Len=4 TSval=2280374199 TSecr=2280373191 [TCP segment of a reassembled PDU]"
"176","18.158762522","127.0.0.1","127.0.0.1","TCP","83","60684  >  8080 [PSH, ACK] Seq=11 Ack=220 Win=65536 Len=17 TSval=2280374199 TSecr=2280374199"
"178","18.158795325","127.0.0.1","127.0.0.1","TCP","66","60684  >  8080 [FIN, ACK] Seq=28 Ack=220 Win=65536 Len=0 TSval=2280374199 TSecr=2280374199"
"180","18.158856497","127.0.0.1","127.0.0.1","TCP","66","60684  >  8080 [ACK] Seq=29 Ack=221 Win=65536 Len=0 TSval=2280374199 TSecr=2280374199"
"181","18.160392388","127.0.0.1","127.0.0.1","TCP","74","60686  >  8080 [SYN] Seq=0 Win=65495 Len=0 MSS=65495 SACK_PERM=1 TSval=2280374201 TSecr=0 WS=128"
"183","18.160405266","127.0.0.1","127.0.0.1","TCP","66","60686  >  8080 [ACK] Seq=1 Ack=1 Win=65536 Len=0 TSval=2280374201 TSecr=2280374201"
"184","18.160437372","127.0.0.1","127.0.0.1","TCP","70","60686  >  8080 [PSH, ACK] Seq=1 Ack=1 Win=65536 Len=4 TSval=2280374201 TSecr=2280374201"
"186","18.160446810","127.0.0.1","127.0.0.1","TCP","68","60686  >  8080 [PSH, ACK] Seq=5 Ack=1 Win=65536 Len=2 TSval=2280374201 TSecr=2280374201 [TCP segment of a reassembled PDU]"
"189","18.162933041","127.0.0.1","127.0.0.1","TCP","66","60686  >  8080 [ACK] Seq=7 Ack=13 Win=65536 Len=0 TSval=2280374203 TSecr=2280374203"
"191","19.163997390","127.0.0.1","127.0.0.1","TCP","66","60686  >  8080 [ACK] Seq=7 Ack=21 Win=65536 Len=0 TSval=2280375204 TSecr=2280375204"
"193","19.164062266","127.0.0.1","127.0.0.1","TCP","66","60686  >  8080 [ACK] Seq=7 Ack=220 Win=65408 Len=0 TSval=2280375204 TSecr=2280375204"
"194","20.173845367","127.0.0.1","127.0.0.1","TCP","70","60686  >  8080 [PSH, ACK] Seq=7 Ack=220 Win=65536 Len=4 TSval=2280376214 TSecr=2280375204 [TCP segment of a reassembled PDU]"
"196","20.173892406","127.0.0.1","127.0.0.1","TCP","83","60686  >  8080 [PSH, ACK] Seq=11 Ack=220 Win=65536 Len=17 TSval=2280376214 TSecr=2280376214"
"198","20.173923972","127.0.0.1","127.0.0.1","TCP","66","60686  >  8080 [FIN, ACK] Seq=28 Ack=220 Win=65536 Len=0 TSval=2280376214 TSecr=2280376214"
"200","20.173968957","127.0.0.1","127.0.0.1","TCP","66","60686  >  8080 [ACK] Seq=29 Ack=221 Win=65536 Len=0 TSval=2280376214 TSecr=2280376214"
"201","20.175485556","127.0.0.1","127.0.0.1","TCP","74","60688  >  8080 [SYN] Seq=0 Win=65495 Len=0 MSS=65495 SACK_PERM=1 TSval=2280376216 TSecr=0 WS=128"
"203","20.175498479","127.0.0.1","127.0.0.1","TCP","66","60688  >  8080 [ACK] Seq=1 Ack=1 Win=65536 Len=0 TSval=2280376216 TSecr=2280376216"
"204","20.175530553","127.0.0.1","127.0.0.1","TCP","70","60688  >  8080 [PSH, ACK] Seq=1 Ack=1 Win=65536 Len=4 TSval=2280376216 TSecr=2280376216"
"206","20.175539615","127.0.0.1","127.0.0.1","TCP","68","60688  >  8080 [PSH, ACK] Seq=5 Ack=1 Win=65536 Len=2 TSval=2280376216 TSecr=2280376216 [TCP segment of a reassembled PDU]"
"209","20.177969802","127.0.0.1","127.0.0.1","TCP","66","60688  >  8080 [ACK] Seq=7 Ack=14 Win=65536 Len=0 TSval=2280376218 TSecr=2280376218"
"211","21.180652122","127.0.0.1","127.0.0.1","TCP","66","60688  >  8080 [ACK] Seq=7 Ack=22 Win=65536 Len=0 TSval=2280377221 TSecr=2280377221"
"213","21.180668975","127.0.0.1","127.0.0.1","TCP","66","60688  >  8080 [ACK] Seq=7 Ack=221 Win=65408 Len=0 TSval=2280377221 TSecr=2280377221"
"214","22.189512003","127.0.0.1","127.0.0.1","TCP","70","60688  >  8080 [PSH, ACK] Seq=7 Ack=221 Win=65536 Len=4 TSval=2280378230 TSecr=2280377221 [TCP segment of a reassembled PDU]"
"216","22.189561289","127.0.0.1","127.0.0.1","TCP","83","60688  >  8080 [PSH, ACK] Seq=11 Ack=221 Win=65536 Len=17 TSval=2280378230 TSecr=2280378230"
"218","22.189593955","127.0.0.1","127.0.0.1","TCP","66","60688  >  8080 [FIN, ACK] Seq=28 Ack=221 Win=65536 Len=0 TSval=2280378230 TSecr=2280378230"
"220","22.189626276","127.0.0.1","127.0.0.1","TCP","66","60688  >  8080 [ACK] Seq=29 Ack=222 Win=65536 Len=0 TSval=2280378230 TSecr=2280378230"
"221","22.191156917","127.0.0.1","127.0.0.1","TCP","74","60690  >  8080 [SYN] Seq=0 Win=65495 Len=0 MSS=65495 SACK_PERM=1 TSval=2280378232 TSecr=0 WS=128"
"223","22.191170266","127.0.0.1","127.0.0.1","TCP","66","60690  >  8080 [ACK] Seq=1 Ack=1 Win=65536 Len=0 TSval=2280378232 TSecr=2280378232"
"224","22.191202733","127.0.0.1","127.0.0.1","TCP","70","60690  >  8080 [PSH, ACK] Seq=1 Ack=1 Win=65536 Len=4 TSval=2280378232 TSecr=2280378232"
"226","22.191212014","127.0.0.1","127.0.0.1","TCP","68","60690  >  8080 [PSH, ACK] Seq=5 Ack=1 Win=65536 Len=2 TSval=2280378232 TSecr=2280378232 [TCP segment of a reassembled PDU]"
"229","22.193694925","127.0.0.1","127.0.0.1","TCP","66","60690  >  8080 [ACK] Seq=7 Ack=14 Win=65536 Len=0 TSval=2280378234 TSecr=2280378234"
"231","23.194814408","127.0.0.1","127.0.0.1","TCP","66","60690  >  8080 [ACK] Seq=7 Ack=22 Win=65536 Len=0 TSval=2280379235 TSecr=2280379235"
"233","23.194844160","127.0.0.1","127.0.0.1","TCP","66","60690  >  8080 [ACK] Seq=7 Ack=221 Win=65408 Len=0 TSval=2280379235 TSecr=2280379235"
"234","24.202719901","127.0.0.1","127.0.0.1","TCP","70","60690  >  8080 [PSH, ACK] Seq=7 Ack=221 Win=65536 Len=4 TSval=2280380243 TSecr=2280379235 [TCP segment of a reassembled PDU]"
"236","24.202769665","127.0.0.1","127.0.0.1","TCP","83","60690  >  8080 [PSH, ACK] Seq=11 Ack=221 Win=65536 Len=17 TSval=2280380243 TSecr=2280380243"
"238","24.202790055","127.0.0.1","127.0.0.1","TCP","66","60690  >  8080 [FIN, ACK] Seq=28 Ack=221 Win=65536 Len=0 TSval=2280380243 TSecr=2280380243"
"240","24.202867701","127.0.0.1","127.0.0.1","TCP","66","60690  >  8080 [ACK] Seq=29 Ack=222 Win=65536 Len=0 TSval=2280380243 TSecr=2280380243"
"241","24.204407164","127.0.0.1","127.0.0.1","TCP","74","60692  >  8080 [SYN] Seq=0 Win=65495 Len=0 MSS=65495 SACK_PERM=1 TSval=2280380245 TSecr=0 WS=128"
"243","24.204419287","127.0.0.1","127.0.0.1","TCP","66","60692  >  8080 [ACK] Seq=1 Ack=1 Win=65536 Len=0 TSval=2280380245 TSecr=2280380245"
"244","24.204452607","127.0.0.1","127.0.0.1","TCP","70","60692  >  8080 [PSH, ACK] Seq=1 Ack=1 Win=65536 Len=4 TSval=2280380245 TSecr=2280380245"
"246","24.204462806","127.0.0.1","127.0.0.1","TCP","68","60692  >  8080 [PSH, ACK] Seq=5 Ack=1 Win=65536 Len=2 TSval=2280380245 TSecr=2280380245 [TCP segment of a reassembled PDU]"
"249","24.206978490","127.0.0.1","127.0.0.1","TCP","66","60692  >  8080 [ACK] Seq=7 Ack=14 Win=65536 Len=0 TSval=2280380247 TSecr=2280380247"
"251","25.211033715","127.0.0.1","127.0.0.1","TCP","66","60692  >  8080 [ACK] Seq=7 Ack=22 Win=65536 Len=0 TSval=2280381251 TSecr=2280381251"
"253","25.211085803","127.0.0.1","127.0.0.1","TCP","66","60692  >  8080 [ACK] Seq=7 Ack=221 Win=65408 Len=0 TSval=2280381251 TSecr=2280381251"
"254","26.220076699","127.0.0.1","127.0.0.1","TCP","70","60692  >  8080 [PSH, ACK] Seq=7 Ack=221 Win=65536 Len=4 TSval=2280382260 TSecr=2280381251 [TCP segment of a reassembled PDU]"
"256","26.220114337","127.0.0.1","127.0.0.1","TCP","83","60692  >  8080 [PSH, ACK] Seq=11 Ack=221 Win=65536 Len=17 TSval=2280382260 TSecr=2280382260"
"258","26.220145238","127.0.0.1","127.0.0.1","TCP","66","60692  >  8080 [FIN, ACK] Seq=28 Ack=221 Win=65536 Len=0 TSval=2280382261 TSecr=2280382260"
"260","26.220204176","127.0.0.1","127.0.0.1","TCP","66","60692  >  8080 [ACK] Seq=29 Ack=222 Win=65536 Len=0 TSval=2280382261 TSecr=2280382261"
"261","26.221704875","127.0.0.1","127.0.0.1","TCP","74","60694  >  8080 [SYN] Seq=0 Win=65495 Len=0 MSS=65495 SACK_PERM=1 TSval=2280382262 TSecr=0 WS=128"
"263","26.221717521","127.0.0.1","127.0.0.1","TCP","66","60694  >  8080 [ACK] Seq=1 Ack=1 Win=65536 Len=0 TSval=2280382262 TSecr=2280382262"
"264","26.221751095","127.0.0.1","127.0.0.1","TCP","70","60694  >  8080 [PSH, ACK] Seq=1 Ack=1 Win=65536 Len=4 TSval=2280382262 TSecr=2280382262"
"266","26.221759960","127.0.0.1","127.0.0.1","TCP","68","60694  >  8080 [PSH, ACK] Seq=5 Ack=1 Win=65536 Len=2 TSval=2280382262 TSecr=2280382262 [TCP segment of a reassembled PDU]"
"269","26.224267111","127.0.0.1","127.0.0.1","TCP","66","60694  >  8080 [ACK] Seq=7 Ack=14 Win=65536 Len=0 TSval=2280382265 TSecr=2280382265"
"271","27.228908719","127.0.0.1","127.0.0.1","TCP","66","60694  >  8080 [ACK] Seq=7 Ack=22 Win=65536 Len=0 TSval=2280383269 TSecr=2280383269"
"273","27.228962257","127.0.0.1","127.0.0.1","TCP","66","60694  >  8080 [ACK] Seq=7 Ack=221 Win=65408 Len=0 TSval=2280383269 TSecr=2280383269"
"274","28.239106480","127.0.0.1","127.0.0.1","TCP","70","60694  >  8080 [PSH, ACK] Seq=7 Ack=221 Win=65536 Len=4 TSval=2280384279 TSecr=2280383269 [TCP segment of a reassembled PDU]"
"276","28.239153973","127.0.0.1","127.0.0.1","TCP","83","60694  >  8080 [PSH, ACK] Seq=11 Ack=221 Win=65536 Len=17 TSval=2280384280 TSecr=2280384279"
"278","28.239173792","127.0.0.1","127.0.0.1","TCP","66","60694  >  8080 [FIN, ACK] Seq=28 Ack=221 Win=65536 Len=0 TSval=2280384280 TSecr=2280384280"
"280","28.239252361","127.0.0.1","127.0.0.1","TCP","66","60694  >  8080 [ACK] Seq=29 Ack=222 Win=65536 Len=0 TSval=2280384280 TSecr=2280384280"
"281","28.240703673","127.0.0.1","127.0.0.1","TCP","74","60696  >  8080 [SYN] Seq=0 Win=65495 Len=0 MSS=65495 SACK_PERM=1 TSval=2280384281 TSecr=0 WS=128"
"283","28.240714956","127.0.0.1","127.0.0.1","TCP","66","60696  >  8080 [ACK] Seq=1 Ack=1 Win=65536 Len=0 TSval=2280384281 TSecr=2280384281"
"284","28.240743996","127.0.0.1","127.0.0.1","TCP","70","60696  >  8080 [PSH, ACK] Seq=1 Ack=1 Win=65536 Len=4 TSval=2280384281 TSecr=2280384281"
"286","28.240752426","127.0.0.1","127.0.0.1","TCP","68","60696  >  8080 [PSH, ACK] Seq=5 Ack=1 Win=65536 Len=2 TSval=2280384281 TSecr=2280384281 [TCP segment of a reassembled PDU]"
"289","28.243073477","127.0.0.1","127.0.0.1","TCP","66","60696  >  8080 [ACK] Seq=7 Ack=14 Win=65536 Len=0 TSval=2280384283 TSecr=2280384283"
"291","29.246510168","127.0.0.1","127.0.0.1","TCP","66","60696  >  8080 [ACK] Seq=7 Ack=22 Win=65536 Len=0 TSval=2280385287 TSecr=2280385287"
"293","29.246582972","127.0.0.1","127.0.0.1","TCP","66","60696  >  8080 [ACK] Seq=7 Ack=221 Win=65408 Len=0 TSval=2280385287 TSecr=2280385287"
"294","30.255722501","127.0.0.1","127.0.0.1","TCP","70","60696  >  8080 [PSH, ACK] Seq=7 Ack=221 Win=65536 Len=4 TSval=2280386296 TSecr=2280385287 [TCP segment of a reassembled PDU]"
"296","30.255758976","127.0.0.1","127.0.0.1","TCP","83","60696  >  8080 [PSH, ACK] Seq=11 Ack=221 Win=65536 Len=17 TSval=2280386296 TSecr=2280386296"
"298","30.255791193","127.0.0.1","127.0.0.1","TCP","66","60696  >  8080 [FIN, ACK] Seq=28 Ack=221 Win=65536 Len=0 TSval=2280386296 TSecr=2280386296"
"300","30.255844451","127.0.0.1","127.0.0.1","TCP","66","60696  >  8080 [ACK] Seq=29 Ack=222 Win=65536 Len=0 TSval=2280386296 TSecr=2280386296"
"301","30.257470598","127.0.0.1","127.0.0.1","TCP","74","60698  >  8080 [SYN] Seq=0 Win=65495 Len=0 MSS=65495 SACK_PERM=1 TSval=2280386298 TSecr=0 WS=128"
"303","30.257484016","127.0.0.1","127.0.0.1","TCP","66","60698  >  8080 [ACK] Seq=1 Ack=1 Win=65536 Len=0 TSval=2280386298 TSecr=2280386298"
"304","30.257529044","127.0.0.1","127.0.0.1","TCP","70","60698  >  8080 [PSH, ACK] Seq=1 Ack=1 Win=65536 Len=4 TSval=2280386298 TSecr=2280386298"
"306","30.257539429","127.0.0.1","127.0.0.1","TCP","68","60698  >  8080 [PSH, ACK] Seq=5 Ack=1 Win=65536 Len=2 TSval=2280386298 TSecr=2280386298 [TCP segment of a reassembled PDU]"
"309","30.260308276","127.0.0.1","127.0.0.1","TCP","66","60698  >  8080 [ACK] Seq=7 Ack=14 Win=65536 Len=0 TSval=2280386301 TSecr=2280386301"
"311","31.263774319","127.0.0.1","127.0.0.1","TCP","66","60698  >  8080 [ACK] Seq=7 Ack=22 Win=65536 Len=0 TSval=2280387304 TSecr=2280387304"
"313","31.263788197","127.0.0.1","127.0.0.1","TCP","66","60698  >  8080 [ACK] Seq=7 Ack=221 Win=65408 Len=0 TSval=2280387304 TSecr=2280387304"
"314","32.271718371","127.0.0.1","127.0.0.1","TCP","70","60698  >  8080 [PSH, ACK] Seq=7 Ack=221 Win=65536 Len=4 TSval=2280388312 TSecr=2280387304 [TCP segment of a reassembled PDU]"
"316","32.271758389","127.0.0.1","127.0.0.1","TCP","83","60698  >  8080 [PSH, ACK] Seq=11 Ack=221 Win=65536 Len=17 TSval=2280388312 TSecr=2280388312"
"318","32.271791138","127.0.0.1","127.0.0.1","TCP","66","60698  >  8080 [FIN, ACK] Seq=28 Ack=221 Win=65536 Len=0 TSval=2280388312 TSecr=2280388312"
"320","32.271846555","127.0.0.1","127.0.0.1","TCP","66","60698  >  8080 [ACK] Seq=29 Ack=222 Win=65536 Len=0 TSval=2280388312 TSecr=2280388312"
"321","32.273565230","127.0.0.1","127.0.0.1","TCP","74","60700  >  8080 [SYN] Seq=0 Win=65495 Len=0 MSS=65495 SACK_PERM=1 TSval=2280388314 TSecr=0 WS=128"
"323","32.273579710","127.0.0.1","127.0.0.1","TCP","66","60700  >  8080 [ACK] Seq=1 Ack=1 Win=65536 Len=0 TSval=2280388314 TSecr=2280388314"
"324","32.273615340","127.0.0.1","127.0.0.1","TCP","70","60700  >  8080 [PSH, ACK] Seq=1 Ack=1 Win=65536 Len=4 TSval=2280388314 TSecr=2280388314"
"326","32.273624678","127.0.0.1","127.0.0.1","TCP","68","60700  >  8080 [PSH, ACK] Seq=5 Ack=1 Win=65536 Len=2 TSval=2280388314 TSecr=2280388314 [TCP segment of a reassembled PDU]"
"329","32.276459944","127.0.0.1","127.0.0.1","TCP","66","60700  >  8080 [ACK] Seq=7 Ack=14 Win=65536 Len=0 TSval=2280388317 TSecr=2280388317"
"331","33.280662370","127.0.0.1","127.0.0.1","TCP","66","60700  >  8080 [ACK] Seq=7 Ack=22 Win=65536 Len=0 TSval=2280389321 TSecr=2280389321"
"333","33.280720286","127.0.0.1","127.0.0.1","TCP","66","60700  >  8080 [ACK] Seq=7 Ack=221 Win=65408 Len=0 TSval=2280389321 TSecr=2280389321"
"334","34.287064908","127.0.0.1","127.0.0.1","TCP","70","60700  >  8080 [PSH, ACK] Seq=7 Ack=221 Win=65536 Len=4 TSval=2280390327 TSecr=2280389321 [TCP segment of a reassembled PDU]"
"336","34.287128611","127.0.0.1","127.0.0.1","TCP","83","60700  >  8080 [PSH, ACK] Seq=11 Ack=221 Win=65536 Len=17 TSval=2280390328 TSecr=2280390327"
"338","34.287164840","127.0.0.1","127.0.0.1","TCP","66","60700  >  8080 [FIN, ACK] Seq=28 Ack=221 Win=65536 Len=0 TSval=2280390328 TSecr=2280390328"
"340","34.287209557","127.0.0.1","127.0.0.1","TCP","66","60700  >  8080 [ACK] Seq=29 Ack=222 Win=65536 Len=0 TSval=2280390328 TSecr=2280390328"
"341","34.288879888","127.0.0.1","127.0.0.1","TCP","74","60702  >  8080 [SYN] Seq=0 Win=65495 Len=0 MSS=65495 SACK_PERM=1 TSval=2280390329 TSecr=0 WS=128"
"343","34.288893548","127.0.0.1","127.0.0.1","TCP","66","60702  >  8080 [ACK] Seq=1 Ack=1 Win=65536 Len=0 TSval=2280390329 TSecr=2280390329"
"344","34.288928611","127.0.0.1","127.0.0.1","TCP","70","60702  >  8080 [PSH, ACK] Seq=1 Ack=1 Win=65536 Len=4 TSval=2280390329 TSecr=2280390329"
"346","34.288938259","127.0.0.1","127.0.0.1","TCP","68","60702  >  8080 [PSH, ACK] Seq=5 Ack=1 Win=65536 Len=2 TSval=2280390329 TSecr=2280390329 [TCP segment of a reassembled PDU]"
"349","34.291958231","127.0.0.1","127.0.0.1","TCP","66","60702  >  8080 [ACK] Seq=7 Ack=14 Win=65536 Len=0 TSval=2280390332 TSecr=2280390332"
"351","35.296269587","127.0.0.1","127.0.0.1","TCP","66","60702  >  8080 [ACK] Seq=7 Ack=22 Win=65536 Len=0 TSval=2280391337 TSecr=2280391337"
"353","35.296320389","127.0.0.1","127.0.0.1","TCP","66","60702  >  8080 [ACK] Seq=7 Ack=221 Win=65408 Len=0 TSval=2280391337 TSecr=2280391337"
"354","36.306926837","127.0.0.1","127.0.0.1","TCP","70","60702  >  8080 [PSH, ACK] Seq=7 Ack=221 Win=65536 Len=4 TSval=2280392347 TSecr=2280391337 [TCP segment of a reassembled PDU]"
"356","36.306974343","127.0.0.1","127.0.0.1","TCP","83","60702  >  8080 [PSH, ACK] Seq=11 Ack=221 Win=65536 Len=17 TSval=2280392347 TSecr=2280392347"
"358","36.307005575","127.0.0.1","127.0.0.1","TCP","66","60702  >  8080 [FIN, ACK] Seq=28 Ack=221 Win=65536 Len=0 TSval=2280392347 TSecr=2280392347"
"360","36.307067311","127.0.0.1","127.0.0.1","TCP","66","60702  >  8080 [ACK] Seq=29 Ack=222 Win=65536 Len=0 TSval=2280392347 TSecr=2280392347"
"361","36.308624874","127.0.0.1","127.0.0.1","TCP","74","60704  >  8080 [SYN] Seq=0 Win=65495 Len=0 MSS=65495 SACK_PERM=1 TSval=2280392349 TSecr=0 WS=128"
"363","36.308637030","127.0.0.1","127.0.0.1","TCP","66","60704  >  8080 [ACK] Seq=1 Ack=1 Win=65536 Len=0 TSval=2280392349 TSecr=2280392349"
"364","36.308667529","127.0.0.1","127.0.0.1","TCP","70","60704  >  8080 [PSH, ACK] Seq=1 Ack=1 Win=65536 Len=4 TSval=2280392349 TSecr=2280392349"
"366","36.308676368","127.0.0.1","127.0.0.1","TCP","68","60704  >  8080 [PSH, ACK] Seq=5 Ack=1 Win=65536 Len=2 TSval=2280392349 TSecr=2280392349 [TCP segment of a reassembled PDU]"
"369","36.311131697","127.0.0.1","127.0.0.1","TCP","66","60704  >  8080 [ACK] Seq=7 Ack=14 Win=65536 Len=0 TSval=2280392352 TSecr=2280392352"
"371","37.312007566","127.0.0.1","127.0.0.1","TCP","66","60704  >  8080 [ACK] Seq=7 Ack=22 Win=65536 Len=0 TSval=2280393352 TSecr=2280393352"
"373","37.312060483","127.0.0.1","127.0.0.1","TCP","66","60704  >  8080 [ACK] Seq=7 Ack=221 Win=65408 Len=0 TSval=2280393352 TSecr=2280393352"
"374","38.320260036","127.0.0.1","127.0.0.1","TCP","70","60704  >  8080 [PSH, ACK] Seq=7 Ack=221 Win=65536 Len=4 TSval=2280394361 TSecr=2280393352 [TCP segment of a reassembled PDU]"
"376","38.320297083","127.0.0.1","127.0.0.1","TCP","83","60704  >  8080 [PSH, ACK] Seq=11 Ack=221 Win=65536 Len=17 TSval=2280394361 TSecr=2280394361"
"378","38.320316846","127.0.0.1","127.0.0.1","TCP","66","60704  >  8080 [FIN, ACK] Seq=28 Ack=221 Win=65536 Len=0 TSval=2280394361 TSecr=2280394361"
"380","38.320419757","127.0.0.1","127.0.0.1","TCP","66","60704  >  8080 [ACK] Seq=29 Ack=222 Win=65536 Len=0 TSval=2280394361 TSecr=2280394361"
"381","38.321917804","127.0.0.1","127.0.0.1","TCP","74","60706  >  8080 [SYN] Seq=0 Win=65495 Len=0 MSS=65495 SACK_PERM=1 TSval=2280394362 TSecr=0 WS=128"
"383","38.321930057","127.0.0.1","127.0.0.1","TCP","66","60706  >  8080 [ACK] Seq=1 Ack=1 Win=65536 Len=0 TSval=2280394362 TSecr=2280394362"
"384","38.321960833","127.0.0.1","127.0.0.1","TCP","70","60706  >  8080 [PSH, ACK] Seq=1 Ack=1 Win=65536 Len=4 TSval=2280394362 TSecr=2280394362"
"386","38.321970035","127.0.0.1","127.0.0.1","TCP","68","60706  >  8080 [PSH, ACK] Seq=5 Ack=1 Win=65536 Len=2 TSval=2280394362 TSecr=2280394362 [TCP segment of a reassembled PDU]"
"389","38.324525799","127.0.0.1","127.0.0.1","TCP","66","60706  >  8080 [ACK] Seq=7 Ack=14 Win=65536 Len=0 TSval=2280394365 TSecr=2280394365"
"391","39.325083379","127.0.0.1","127.0.0.1","TCP","66","60706  >  8080 [ACK] Seq=7 Ack=22 Win=65536 Len=0 TSval=2280395365 TSecr=2280395365"
"393","39.325176346","127.0.0.1","127.0.0.1","TCP","66","60706  >  8080 [ACK] Seq=7 Ack=221 Win=65408 Len=0 TSval=2280395366 TSecr=2280395366"
"394","40.332237504","127.0.0.1","127.0.0.1","TCP","70","60706  >  8080 [PSH, ACK] Seq=7 Ack=221 Win=65536 Len=4 TSval=2280396373 TSecr=2280395366 [TCP segment of a reassembled PDU]"
"396","40.332322614","127.0.0.1","127.0.0.1","TCP","83","60706  >  8080 [PSH, ACK] Seq=11 Ack=221 Win=65536 Len=17 TSval=2280396373 TSecr=2280396373"
"398","40.332428958","127.0.0.1","127.0.0.1","TCP","66","60706  >  8080 [FIN, ACK] Seq=28 Ack=221 Win=65536 Len=0 TSval=2280396373 TSecr=2280396373"
"400","40.332494242","127.0.0.1","127.0.0.1","TCP","66","60706  >  8080 [ACK] Seq=29 Ack=222 Win=65536 Len=0 TSval=2280396373 TSecr=2280396373"
"401","40.336287254","127.0.0.1","127.0.0.1","TCP","74","60708  >  8080 [SYN] Seq=0 Win=65495 Len=0 MSS=65495 SACK_PERM=1 TSval=2280396377 TSecr=0 WS=128"
"403","40.336316426","127.0.0.1","127.0.0.1","TCP","66","60708  >  8080 [ACK] Seq=1 Ack=1 Win=65536 Len=0 TSval=2280396377 TSecr=2280396377"
"404","40.336399967","127.0.0.1","127.0.0.1","TCP","70","60708  >  8080 [PSH, ACK] Seq=1 Ack=1 Win=65536 Len=4 TSval=2280396377 TSecr=2280396377"
"406","40.336423977","127.0.0.1","127.0.0.1","TCP","68","60708  >  8080 [PSH, ACK] Seq=5 Ack=1 Win=65536 Len=2 TSval=2280396377 TSecr=2280396377 [TCP segment of a reassembled PDU]"
"409","40.342774154","127.0.0.1","127.0.0.1","TCP","66","60708  >  8080 [ACK] Seq=7 Ack=14 Win=65536 Len=0 TSval=2280396383 TSecr=2280396383"
"411","41.346855749","127.0.0.1","127.0.0.1","TCP","66","60708  >  8080 [ACK] Seq=7 Ack=22 Win=65536 Len=0 TSval=2280397387 TSecr=2280397387"
"413","41.346907908","127.0.0.1","127.0.0.1","TCP","66","60708  >  8080 [ACK] Seq=7 Ack=221 Win=65408 Len=0 TSval=2280397387 TSecr=2280397387"
"414","42.355081059","127.0.0.1","127.0.0.1","TCP","70","60708  >  8080 [PSH, ACK] Seq=7 Ack=221 Win=65536 Len=4 TSval=2280398395 TSecr=2280397387 [TCP segment of a reassembled PDU]"
"416","42.355118629","127.0.0.1","127.0.0.1","TCP","83","60708  >  8080 [PSH, ACK] Seq=11 Ack=221 Win=65536 Len=17 TSval=2280398395 TSecr=2280398395"
"418","42.355179656","127.0.0.1","127.0.0.1","TCP","66","60708  >  8080 [FIN, ACK] Seq=28 Ack=221 Win=65536 Len=0 TSval=2280398396 TSecr=2280398395"
"420","42.355427222","127.0.0.1","127.0.0.1","TCP","66","60708  >  8080 [ACK] Seq=29 Ack=222 Win=65536 Len=0 TSval=2280398396 TSecr=2280398396"
"421","42.356953341","127.0.0.1","127.0.0.1","TCP","74","60710  >  8080 [SYN] Seq=0 Win=65495 Len=0 MSS=65495 SACK_PERM=1 TSval=2280398397 TSecr=0 WS=128"
"423","42.356965239","127.0.0.1","127.0.0.1","TCP","66","60710  >  8080 [ACK] Seq=1 Ack=1 Win=65536 Len=0 TSval=2280398397 TSecr=2280398397"
"424","42.357020603","127.0.0.1","127.0.0.1","TCP","70","60710  >  8080 [PSH, ACK] Seq=1 Ack=1 Win=65536 Len=4 TSval=2280398397 TSecr=2280398397"
"426","42.357029145","127.0.0.1","127.0.0.1","TCP","68","60710  >  8080 [PSH, ACK] Seq=5 Ack=1 Win=65536 Len=2 TSval=2280398397 TSecr=2280398397 [TCP segment of a reassembled PDU]"
"429","42.359344361","127.0.0.1","127.0.0.1","TCP","66","60710  >  8080 [ACK] Seq=7 Ack=14 Win=65536 Len=0 TSval=2280398400 TSecr=2280398400"
"431","43.362489884","127.0.0.1","127.0.0.1","TCP","66","60710  >  8080 [ACK] Seq=7 Ack=22 Win=65536 Len=0 TSval=2280399403 TSecr=2280399403"
"433","43.362539254","127.0.0.1","127.0.0.1","TCP","66","60710  >  8080 [ACK] Seq=7 Ack=221 Win=65408 Len=0 TSval=2280399403 TSecr=2280399403"
"434","44.372335153","127.0.0.1","127.0.0.1","TCP","70","60710  >  8080 [PSH, ACK] Seq=7 Ack=221 Win=65536 Len=4 TSval=2280400413 TSecr=2280399403 [TCP segment of a reassembled PDU]"
"436","44.372373103","127.0.0.1","127.0.0.1","TCP","83","60710  >  8080 [PSH, ACK] Seq=11 Ack=221 Win=65536 Len=17 TSval=2280400413 TSecr=2280400413"
"438","44.372394075","127.0.0.1","127.0.0.1","TCP","66","60710  >  8080 [FIN, ACK] Seq=28 Ack=221 Win=65536 Len=0 TSval=2280400413 TSecr=2280400413"
"440","44.372460182","127.0.0.1","127.0.0.1","TCP","66","60710  >  8080 [ACK] Seq=29 Ack=222 Win=65536 Len=0 TSval=2280400413 TSecr=2280400413"
"441","44.373892186","127.0.0.1","127.0.0.1","TCP","74","60712  >  8080 [SYN] Seq=0 Win=65495 Len=0 MSS=65495 SACK_PERM=1 TSval=2280400414 TSecr=0 WS=128"
"443","44.373904459","127.0.0.1","127.0.0.1","TCP","66","60712  >  8080 [ACK] Seq=1 Ack=1 Win=65536 Len=0 TSval=2280400414 TSecr=2280400414"
"444","44.373936225","127.0.0.1","127.0.0.1","TCP","70","60712  >  8080 [PSH, ACK] Seq=1 Ack=1 Win=65536 Len=4 TSval=2280400414 TSecr=2280400414"
"446","44.373945221","127.0.0.1","127.0.0.1","TCP","68","60712  >  8080 [PSH, ACK] Seq=5 Ack=1 Win=65536 Len=2 TSval=2280400414 TSecr=2280400414 [TCP segment of a reassembled PDU]"
"449","44.376475887","127.0.0.1","127.0.0.1","TCP","66","60712  >  8080 [ACK] Seq=7 Ack=14 Win=65536 Len=0 TSval=2280400417 TSecr=2280400417"
"451","45.380466162","127.0.0.1","127.0.0.1","TCP","66","60712  >  8080 [ACK] Seq=7 Ack=22 Win=65536 Len=0 TSval=2280401421 TSecr=2280401421"
"453","45.380484197","127.0.0.1","127.0.0.1","TCP","66","60712  >  8080 [ACK] Seq=7 Ack=221 Win=65408 Len=0 TSval=2280401421 TSecr=2280401421"
"454","46.388831391","127.0.0.1","127.0.0.1","TCP","70","60712  >  8080 [PSH, ACK] Seq=7 Ack=221 Win=65536 Len=4 TSval=2280402429 TSecr=2280401421 [TCP segment of a reassembled PDU]"
"456","46.388865429","127.0.0.1","127.0.0.1","TCP","83","60712  >  8080 [PSH, ACK] Seq=11 Ack=221 Win=65536 Len=17 TSval=2280402429 TSecr=2280402429"
"458","46.388885087","127.0.0.1","127.0.0.1","TCP","66","60712  >  8080 [FIN, ACK] Seq=28 Ack=221 Win=65536 Len=0 TSval=2280402429 TSecr=2280402429"
"460","46.388935657","127.0.0.1","127.0.0.1","TCP","66","60712  >  8080 [ACK] Seq=29 Ack=222 Win=65536 Len=0 TSval=2280402429 TSecr=2280402429"
"461","46.390418491","127.0.0.1","127.0.0.1","TCP","74","60714  >  8080 [SYN] Seq=0 Win=65495 Len=0 MSS=65495 SACK_PERM=1 TSval=2280402431 TSecr=0 WS=128"
"463","46.390429876","127.0.0.1","127.0.0.1","TCP","66","60714  >  8080 [ACK] Seq=1 Ack=1 Win=65536 Len=0 TSval=2280402431 TSecr=2280402431"
"464","46.390461679","127.0.0.1","127.0.0.1","TCP","70","60714  >  8080 [PSH, ACK] Seq=1 Ack=1 Win=65536 Len=4 TSval=2280402431 TSecr=2280402431"
"466","46.390470626","127.0.0.1","127.0.0.1","TCP","68","60714  >  8080 [PSH, ACK] Seq=5 Ack=1 Win=65536 Len=2 TSval=2280402431 TSecr=2280402431 [TCP segment of a reassembled PDU]"
"469","46.392972028","127.0.0.1","127.0.0.1","TCP","66","60714  >  8080 [ACK] Seq=7 Ack=14 Win=65536 Len=0 TSval=2280402433 TSecr=2280402433"
"471","47.397665135","127.0.0.1","127.0.0.1","TCP","66","60714  >  8080 [ACK] Seq=7 Ack=22 Win=65536 Len=0 TSval=2280403438 TSecr=2280403438"
"473","47.397716449","127.0.0.1","127.0.0.1","TCP","66","60714  >  8080 [ACK] Seq=7 Ack=221 Win=65408 Len=0 TSval=2280403438 TSecr=2280403438"
"474","48.406582173","127.0.0.1","127.0.0.1","TCP","70","60714  >  8080 [PSH, ACK] Seq=7 Ack=221 Win=65536 Len=4 TSval=2280404447 TSecr=2280403438 [TCP segment of a reassembled PDU]"
"476","48.406650607","127.0.0.1","127.0.0.1","TCP","83","60714  >  8080 [PSH, ACK] Seq=11 Ack=221 Win=65536 Len=17 TSval=2280404447 TSecr=2280404447"
"478","48.406670655","127.0.0.1","127.0.0.1","TCP","66","60714  >  8080 [FIN, ACK] Seq=28 Ack=221 Win=65536 Len=0 TSval=2280404447 TSecr=2280404447"
